{
  "version": 1,
  "loopId": "AI-001",
  "status": "implementing",
  "round": 0,
  "maxReviewRounds": 3,
  "currentTaskId": "AI-009",
  "currentPr": {
    "number": 347,
    "branch": "automation-implement-AI-009-health-final",
    "headSha": "d57c6a0ede5f98357c252a0872d9681d59fb34b8"
  },
  "lastVerdict": null,
  "lastCiStatus": null,
  "reviewedHeadSha": "d57c6a0ede5f98357c252a0872d9681d59fb34b8",
  "blockedReason": null,
  "completedTasks": [
    "AI-001",
    "AI-002",
    "AI-003",
    "AI-004",
    "AI-005",
    "AI-006",
    "AI-007",
    "AI-008"
  ],
  "updatedAt": "2026-10-18T16:39:24Z",
  "history": [
    {
      "at": "2026-10-03T16:23:31Z",
      "status": "next-task",
      "note": "bootstrap recovery before completion"
    },
    {
      "at": "2026-10-03T16:23:31Z",
      "status": "completed",
      "note": "task AI-001 completed"
    },
    {
      "at": "2026-10-03T16:23:31Z",
      "status": "next-task",
      "note": "advancing to next-task generation"
    },
    {
      "at": "2026-10-05T12:04:48Z",
      "status": "completed",
      "note": "task AI-002 completed"
    },
    {
      "at": "2026-10-05T12:04:48Z",
      "status": "next-task",
      "note": "advancing to next-task generation"
    },
    {
      "at": "2026-10-05T17:06:12Z",
      "status": "completed",
      "note": "task AI-003 completed"
    },
    {
      "at": "2026-10-05T17:06:12Z",
      "status": "next-task",
      "note": "advancing to next-task generation"
    },
    {
      "at": "2026-10-06T05:08:12Z",
      "status": "completed",
      "note": "task AI-004 completed"
    },
    {
      "at": "2026-10-06T05:08:12Z",
      "status": "next-task",
      "note": "advancing to next-task generation"
    },
    {
      "at": "2026-10-06T10:03:13Z",
      "status": "completed",
      "note": "task AI-005 completed"
    },
    {
      "at": "2026-10-06T10:03:13Z",
      "status": "next-task",
      "note": "advancing to next-task generation"
    },
    {
      "at": "2026-10-06T10:16:14Z",
      "status": "idle",
      "note": "Next task AI-006 created successfully"
    },
    {
      "at": "2026-10-06T10:25:50Z",
      "status": "idle",
      "note": "ready for implementation workflow"
    },
    {
      "at": "2026-10-06T15:25:53Z",
      "status": "next-task",
      "note": "bootstrap recovery before completion"
    },
    {
      "at": "2026-10-06T15:25:53Z",
      "status": "completed",
      "note": "task AI-006 completed"
    },
    {
      "at": "2026-10-06T15:25:53Z",
      "status": "next-task",
      "note": "advancing to next-task generation"
    },
    {
      "at": "2026-10-07T12:15:18Z",
      "status": "completed",
      "note": "task AI-007 completed"
    },
    {
      "at": "2026-10-07T12:15:18Z",
      "status": "next-task",
      "note": "advancing to next-task generation"
    },
    {
      "at": "2026-10-14T16:26:09Z",
      "status": "completed",
      "note": "task AI-008 completed"
    },
    {
      "at": "2026-10-14T16:26:10Z",
      "status": "next-task",
      "note": "advancing to next-task generation"
    }
  ]
}
